Cp1252,,,,
"AWBaseRequest",1,"Uploaded %s KB of %s KB...","Caricati %s KB su %s KB...","Appears in file upload panel"
"AWComponentActionRequestHandler",1,"Waiting for previous request to complete ...","In attesa che venga completata la richiesta precedente...","Appears in page loading status panel"
"AWComponentActionRequestHandler",2,"Processing request ...","Richiesta in fase di elaborazione...","Appears in page loading status panel"
"AWErrorInfo",1,"Unknown Error","Errore sconosciuto",""
"AWLazyDivInternals",a001,"Loading...","Caricamento in corso...",""
"AWXBasicScriptFunctions",1,"Please enable window popup for this site to use this function.","Abilitare il popup finestra di questo sito per utilizzare questa funzione.",""
"AWComponentReference",1,"An error has occurred while processing your request. Refresh the page and try again.","Si è verificato un errore durante l'elaborazione della richiesta. Aggiornare la pagina e riprovare.",""
